"484","127209","Black Riding Yak","Grummles traveling Kun-Lai Summit by night prefer to ride this dark-haired yak to remain unseen, though they remove the bells from its caparison first.","|cFFFFD200Legacy|r","0","230","64","2","0","4"
"485","127213","Brown Riding Yak","Riding Yaks are bred to be slimmer and more agile than their kin.","|cFFFFD200Legacy|r","0","230","64","2","0","4"
"486","127216","Grey Riding Yak","Riding Yaks are bred to be slimmer and more agile than their kin.","|cFFFFD200Vendor: |rUncle Bigpocket|n|cFFFFD200Zone: |rKun-Lai Summit|n|cFFFFD200Cost: |r3000|TINTERFACE\MONEYFRAME\UI-GOLDICON.BLP:0|t","0","230","0","2","0","4"
"487","127220","Blonde Riding Yak","Riding Yaks are bred to be slimmer and more agile than their kin.","|cFFFFD200Vendor: |rUncle Bigpocket|n|cFFFFD200Zone: |rKun-Lai Summit|n|cFFFFD200Cost: |r3000|TINTERFACE\MONEYFRAME\UI-GOLDICON.BLP:0|t","0","230","0","2","0","4"
"488","127271","Crimson Water Strider","""Normally bugs are for bait, but how could you look into its eyes and even think that?"" -Nat Pagle","|cFFFFD200Vendor: |rNat Pagle|n|cFFFFD200Zone: |rGarrison: Fishing Shack|n|cFFFFD200Faction: |rNat Pagle - Honored|n|cFFFFD200Cost: |r100|TINTERFACE\ICONS\INV_Misc_Coin_19.blp:0|t","0","269","32","2","0","4"
"492","127286","Black Dragon Turtle","Cherished for their heavy carrying capacity and steady gait, these stalwart beasts are the mount of choice for most native Pandaren.","|cFFFFD200Vendor: |rTurtlemaster Odai|n|cFFFFD200Zone: |rOrgrimmar|n|cFFFFD200Cost: |r1|TINTERFACE\MONEYFRAME\UI-GOLDICON.BLP:0|t|n|n|cFFFFD200Vendor: |rOld Whitenose|n|cFFFFD200Zone: |rStormwind City|n|cFFFFD200Cost: |r1|TINTERFACE\MONEYFRAME\UI-GOLDICON.BLP:0|t","0","230","0","2","0","4"
"493","127287","Blue Dragon Turtle","Cherished for their heavy carrying capacity and steady gait, these stalwart beasts are the mount of choice for most native Pandaren.","|cFFFFD200Vendor: |rTurtlemaster Odai|n|cFFFFD200Zone: |rOrgrimmar|n|cFFFFD200Cost: |r1|TINTERFACE\MONEYFRAME\UI-GOLDICON.BLP:0|t|n|n|cFFFFD200Vendor: |rOld Whitenose|n|cFFFFD200Zone: |rStormwind City|n|cFFFFD200Cost: |r1|TINTERFACE\MONEYFRAME\UI-GOLDICON.BLP:0|t","0","230","0","2","0","4"
"494","127288","Brown Dragon Turtle","Cherished for their heavy carrying capacity and steady gait, these stalwart beasts are the mount of choice for most native Pandaren.","|cFFFFD200Vendor: |rTurtlemaster Odai|n|cFFFFD200Zone: |rOrgrimmar|n|cFFFFD200Cost: |r1|TINTERFACE\MONEYFRAME\UI-GOLDICON.BLP:0|t|n|n|cFFFFD200Vendor: |rOld Whitenose|n|cFFFFD200Zone: |rStormwind City|n|cFFFFD200Cost: |r1|TINTERFACE\MONEYFRAME\UI-GOLDICON.BLP:0|t","0","230","0","2","0","4"
"495","127289","Purple Dragon Turtle","Cherished for their heavy carrying capacity and steady gait, these stalwart beasts are the mount of choice for most native Pandaren.","|cFFFFD200Vendor: |rTurtlemaster Odai|n|cFFFFD200Zone: |rOrgrimmar|n|cFFFFD200Cost: |r1|TINTERFACE\MONEYFRAME\UI-GOLDICON.BLP:0|t|n|n|cFFFFD200Vendor: |rOld Whitenose|n|cFFFFD200Zone: |rStormwind City|n|cFFFFD200Cost: |r1|TINTERFACE\MONEYFRAME\UI-GOLDICON.BLP:0|t","0","230","0","2","0","4"
"496","127290","Red Dragon Turtle","Cherished for their heavy carrying capacity and steady gait, these stalwart beasts are the mount of choice for most native Pandaren.","|cFFFFD200Vendor: |rTurtlemaster Odai|n|cFFFFD200Zone: |rOrgrimmar|n|cFFFFD200Cost: |r1|TINTERFACE\MONEYFRAME\UI-GOLDICON.BLP:0|t|n|n|cFFFFD200Vendor: |rOld Whitenose|n|cFFFFD200Zone: |rStormwind City|n|cFFFFD200Cost: |r1|TINTERFACE\MONEYFRAME\UI-GOLDICON.BLP:0|t","0","230","0","2","0","4"
"497","127293","Great Green Dragon Turtle","""Packaged upgrades include; dual-lantern fog lights, emergency brew keg, and genuine Tanji leather seat.""  - Turtlemaster Odai","|cFFFFD200Vendor: |rTurtlemaster Odai|n|cFFFFD200Zone: |rOrgrimmar|n|cFFFFD200Cost: |r10|TINTERFACE\MONEYFRAME\UI-GOLDICON.BLP:0|t|n|n|cFFFFD200Vendor: |rOld Whitenose|n|cFFFFD200Zone: |rStormwind City|n|cFFFFD200Cost: |r10|TINTERFACE\MONEYFRAME\UI-GOLDICON.BLP:0|t","0","230","0","2","0","4"
"498","127295","Great Black Dragon Turtle","""Packaged upgrades include; dual-lantern fog lights, emergency brew keg, and genuine Tanji leather seat.""  - Turtlemaster Odai","|cFFFFD200Vendor: |rTurtlemaster Odai|n|cFFFFD200Zone: |rOrgrimmar|n|cFFFFD200Cost: |r10|TINTERFACE\MONEYFRAME\UI-GOLDICON.BLP:0|t|n|n|cFFFFD200Vendor: |rOld Whitenose|n|cFFFFD200Zone: |rStormwind City|n|cFFFFD200Cost: |r10|TINTERFACE\MONEYFRAME\UI-GOLDICON.BLP:0|t","0","230","0","2","0","4"
"499","127302","Great Blue Dragon Turtle","""Packaged upgrades include; dual-lantern fog lights, emergency brew keg, and genuine Tanji leather seat.""  - Turtlemaster Odai","|cFFFFD200Vendor: |rTurtlemaster Odai|n|cFFFFD200Zone: |rOrgrimmar|n|cFFFFD200Cost: |r10|TINTERFACE\MONEYFRAME\UI-GOLDICON.BLP:0|t|n|n|cFFFFD200Vendor: |rOld Whitenose|n|cFFFFD200Zone: |rStormwind City|n|cFFFFD200Cost: |r10|TINTERFACE\MONEYFRAME\UI-GOLDICON.BLP:0|t","0","230","0","2","0","4"
"500","127308","Great Brown Dragon Turtle","""Packaged upgrades include; dual-lantern fog lights, emergency brew keg, and genuine Tanji leather seat.""  - Turtlemaster Odai","|cFFFFD200Vendor: |rTurtlemaster Odai|n|cFFFFD200Zone: |rOrgrimmar|n|cFFFFD200Cost: |r10|TINTERFACE\MONEYFRAME\UI-GOLDICON.BLP:0|t|n|n|cFFFFD200Vendor: |rOld Whitenose|n|cFFFFD200Zone: |rStormwind City|n|cFFFFD200Cost: |r10|TINTERFACE\MONEYFRAME\UI-GOLDICON.BLP:0|t","0","230","0","2","0","4"
"501","127310","Great Purple Dragon Turtle","""Packaged upgrades include; dual-lantern fog lights, emergency brew keg, and genuine Tanji leather seat.""  - Turtlemaster Odai","|cFFFFD200Vendor: |rTurtlemaster Odai|n|cFFFFD200Zone: |rOrgrimmar|n|cFFFFD200Cost: |r10|TINTERFACE\MONEYFRAME\UI-GOLDICON.BLP:0|t|n|n|cFFFFD200Vendor: |rOld Whitenose|n|cFFFFD200Zone: |rStormwind City|n|cFFFFD200Cost: |r10|TINTERFACE\MONEYFRAME\UI-GOLDICON.BLP:0|t","0","230","0","2","0","4"
"503","129552","Crimson Pandaren Phoenix","The plumage of the Crimson Phoenix is said to represent prosperity and happiness.","|cFFFFD200Vendor: |rKai Featherfall|n|cFFFFD200Location: |rVale of Eternal Blossoms|n|cFFFFD200Cost: |r1|TINTERFACE\ICONS\INV_MISC_PHOENIXEGG.BLP:0|t","0","248","128","2","0","43"
"504","129918","Thundering August Cloud Serpent","From their infancy, Thundering Cloud Serpents are drawn to storms. They have been known to chase lightning through the blackened, roiling clouds, and to bathe in the pouring rain.","|cFFFFD200Vendor: |rSage Whiteheart (Alliance)|n|cFFFFD200Zone: |rVale of Eternal Blossoms|n|cFFFFD200Faction: |rThe August Celestials - Exalted|n|cFFFFD200Cost: |r10000|TINTERFACE\MONEYFRAME\UI-GOLDICON.BLP:0|t|n|n|cFFFFD200Vendor: |rSage Lotusbloom (Horde)|n|cFFFFD200Zone: |rVale of Eternal Blossoms|n|cFFFFD200Faction: |rThe August Celestials - Exalted|n|cFFFFD200Cost: |r10000|TINTERFACE\MONEYFRAME\UI-GOLDICON.BLP:0|t","0","248","128","2","0","4"
"505","129932","Green Shado-Pan Riding Tiger","""When waking a tiger, use a long stick. Better yet, tell your friend to wake the tiger instead."" --Pandaren Proverb","|cFFFFD200Vendor: |rRushi the Fox|n|cFFFFD200Zone: |rTownlong Steppes|n|cFFFFD200Faction: |rShado-Pan - Exalted|n|cFFFFD200Cost: |r1500|TINTERFACE\MONEYFRAME\UI-GOLDICON.BLP:0|t","0","230","0","2","0","4"
"506","129934","Blue Shado-Pan Riding Tiger","""When waking a tiger, use a long stick. Better yet, tell your friend to wake the tiger instead."" --Pandaren Proverb","|cFFFFD200Vendor: |rRushi the Fox|n|cFFFFD200Zone: |rTownlong Steppes|n|cFFFFD200Faction: |rShado-Pan - Exalted|n|cFFFFD200Cost: |r500|TINTERFACE\MONEYFRAME\UI-GOLDICON.BLP:0|t","0","230","0","2","0","4"
"507","129935","Red Shado-Pan Riding Tiger","""When waking a tiger, use a long stick. Better yet, tell your friend to wake the tiger instead."" --Pandaren Proverb","|cFFFFD200Vendor: |rRushi the Fox|n|cFFFFD200Zone: |rTownlong Steppes|n|cFFFFD200Faction: |rShado-Pan - Exalted|n|cFFFFD200Cost: |r2500|TINTERFACE\MONEYFRAME\UI-GOLDICON.BLP:0|t","0","230","0","2","0","4"
"508","130086","Brown Riding Goat","It takes unflagging patience and a gentle touch to train obstinate mountain goats for riding.","|cFFFFD200Vendor: |rGina Mudclaw|n|cFFFFD200Zone: |rValley of the Four Winds|n|cFFFFD200Faction: |rThe Tillers - Exalted|n|cFFFFD200Cost: |r500|TINTERFACE\MONEYFRAME\UI-GOLDICON.BLP:0|t","0","230","0","2","0","44"
"509","130092","Red Flying Cloud","An ancient Mogu artifact awarded to those who are deeply committed to the discovery and sharing of Pandaren lore.","|cFFFFD200Vendor: |rTan Shin Tiao|n|cFFFFD200Zone: |rVale of Eternal Blossoms|n|cFFFFD200Faction: |rThe Lorewalkers - Exalted|n|cFFFFD200Cost: |r600|TINTERFACE\MONEYFRAME\UI-GOLDICON.BLP:0|t","0","247","1024","2","0","4"
"510","130137","White Riding Goat","It takes unflagging patience and a gentle touch to train obstinate mountain goats for riding.","|cFFFFD200Vendor: |rGina Mudclaw|n|cFFFFD200Zone: |rTimeless Isle|n|cFFFFD200Faction: |rThe Tillers - Exalted|n|cFFFFD200Cost: |r3250|TINTERFACE\MONEYFRAME\UI-GOLDICON.BLP:0|t|n|n|cFFFFD200Vendor: |rGina Mudclaw|n|cFFFFD200Zone: |rValley of the Four Winds|n|cFFFFD200Faction: |rThe Tillers - Exalted|n|cFFFFD200Cost: |r3250|TINTERFACE\MONEYFRAME\UI-GOLDICON.BLP:0|t","0","230","0","2","0","44"
"511","130138","Black Riding Goat","It takes unflagging patience and a gentle touch to train obstinate mountain goats for riding.","|cFFFFD200Vendor: |rGina Mudclaw|n|cFFFFD200Zone: |rTimeless Isle|n|cFFFFD200Faction: |rThe Tillers - Exalted|n|cFFFFD200Cost: |r1500|TINTERFACE\MONEYFRAME\UI-GOLDICON.BLP:0|t|n|n|cFFFFD200Vendor: |rGina Mudclaw|n|cFFFFD200Zone: |rValley of the Four Winds|n|cFFFFD200Faction: |rThe Tillers - Exalted|n|cFFFFD200Cost: |r1500|TINTERFACE\MONEYFRAME\UI-GOLDICON.BLP:0|t","0","230","0","2","0","44"
"515","130965","Son of Galleon","Trained from a young age, these massive kushan are taught to thunder into battle carrying a full saurok warband.","|cFFFFD200Drop:|r Galleon|n|cFFFFD200Location:|r Valley of the Four Winds|n","0","230","0","0","0","4"
"516","130985","Pandaren Kite","This token of honor is a gift from the Lorewalkers of Pandaria. Flying manual seemingly not included, however.","|cFFFFD200Achievement: |rPandaren Ambassador|n|cFFFFD200Category: |rPandaria","0","248","1156","5","0","4"
"517","132036","Thundering Ruby Cloud Serpent","From their infancy, Thundering Cloud Serpents are drawn to storms. They have been known to chase lightning through the blackened, roiling clouds, and to bathe in the pouring rain.","|cFFFFD200Drop: |rAlani|n|cFFFFD200Zone: |rVale of Eternal Blossoms","0","248","128","0","0","4"
"518","132117","Ashen Pandaren Phoenix","Both the name and color of this majestic phoenix are believed to symbolize rebirth.","|cFFFFD200Vendor: |rWorld Vendors|n|cFFFFD200Cost: |r1|TINTERFACE\ICONS\INV_MISC_PHOENIXEGG.BLP:0|t","0","248","128","2","0","43"
"519","132118","Emerald Pandaren Phoenix","The colors of this rare phoenix's plumage are said to bring great fortune.","|cFFFFD200Vendor: |rWorld Vendors|n|cFFFFD200Cost: |r1|TINTERFACE\ICONS\INV_MISC_PHOENIXEGG.BLP:0|t","0","248","128","2","0","43"
"520","132119","Violet Pandaren Phoenix","The Violet Phoenix's plumage is said to symbolize a union of opposing forces.","|cFFFFD200Vendor: |rWorld Vendors|n|cFFFFD200Cost: |r1|TINTERFACE\ICONS\INV_MISC_PHOENIXEGG.BLP:0|t","0","248","128","2","0","43"
"521","133023","Jade Pandaren Kite","The residents of Pandaria salute your enthusiasm for wildlife preservation. They do have concerns about housing 150 animals per visit, though.","|cFFFFD200Achievement: |rWe're Going to Need More Saddles|n|cFFFFD200Category: |rGeneral","0","248","1152","5","0","4"
"522","134359","Sky Golem","A glorious feat of engineering, the sky golem takes traditional shredder technology to a whole new level (and altitude!).","|cFFFFD200Profession: |rEngineering","0","248","0","3","0","45"
"523","134573","Swift Windsteed","One of Pandaria's most elusive creatures, said to bring good fortune to its rider.","|cFFFFD200In-Game Shop|r","0","248","128","9","0","4"
"526","135416","Grand Armored Gryphon","This noble gryphon is as staunch a battle companion as any member of the Alliance could ask for.","|cFFFFD200Vendor: |rAgent Malley|n|cFFFFD200Zone: |rKrasarang Wilds|n|cFFFFD200Faction: |rOperation: Shieldwall - Exalted|n|cFFFFD200Cost: |r2000|TINTERFACE\MONEYFRAME\UI-GOLDICON.BLP:0|t","0","248","132","2","0","4"
"527","135418","Grand Armored Wyvern","This ferocious beast, renowned among wyvern handlers, was one of the first mounts chosen to take part in the Horde's Dominance Offensive.","|cFFFFD200Vendor: |rTuskripper Grukna|n|cFFFFD200Zone: |rKrasarang Wilds|n|cFFFFD200Faction: |rDominance Offensive - Exalted|n|cFFFFD200Cost: |r2000|TINTERFACE\MONEYFRAME\UI-GOLDICON.BLP:0|t","0","248","132","2","0","4"
"528","136163","Grand Gryphon","Gryphons' keen eyesight allows them to see over vast distances and warn their riders of any dangers that lie ahead.","|cFFFFD200Quest: |rThe Silence|n|cFFFFD200Zone: |rKun-Lai Summit","0","248","132","1","0","4"
"529","136164","Grand Wyvern","Wyverns hail from some of the most inhospitable regions of Kalimdor, making them masters of adapting to any environment.","|cFFFFD200Quest: |rBreath of Darkest Shadow|n|cFFFFD200Zone: |rKun-Lai Summit","0","248","132","1","0","4"
"530","136400","Armored Skyscreamer","Only those heroic souls who surmount every challenge the mogu tyrants place before them can proudly fly the skies on a war-prepared skyscreamer.","|cFFFFD200Achievement: |rGlory of the Thundering Raider|n|cFFFFD200Category: |rDungeons & Raids","0","248","128","5","0","4"
"531","136471","Spawn of Horridon","When you see a hurricane coming, you get out of the way. Horridon would fight the hurricane and win.","|cFFFFD200Drop: |rHorridon|n|cFFFFD200Zone: |rThrone of Thunder","0","230","0","0","0","4"
"532","136505","Ghastly Charger","Not all of Medivh's victims are gone for good.","|cFFFFD200Vendor: |rLandro Longshot|n|cFFFFD200Location:|r Booty Bay|n","0","248","64","8","0","4"
"533","138423","Cobalt Primordial Direhorn","""When ya fight alongside raptors, ya want a mount dey can't eat."" -Unknown dinomancer","|cFFFFD200Drop:|r Oondasta|n|cFFFFD200Location:|r Isle of Giants","0","230","0","0","0","43"
"534","138424","Amber Primordial Direhorn","There is an old Zandalari saying about wild direhorns: ""Run!""","|cFFFFD200Drop: |rZandalari Warbringer|n|cFFFFD200Zone: |rDread Wastes, Kun-Lai Summit, Townlong Steppes, Valley of the Four Winds","0","230","0","0","0","43"
"535","138425","Slate Primordial Direhorn","The masks aren't to control the direhorn; they are so no one sees your face when it turns on you.","|cFFFFD200Drop: |rZandalari Warbringer|n|cFFFFD200Zone: |rDread Wastes, Krasarang Wilds, Kun-Lai Summit, Townlong Steppes, Valley of the Four Winds","0","230","0","0","0","43"
"536","138426","Jade Primordial Direhorn","The festive coloring belies deadly intent.","|cFFFFD200Drop: |rZandalari Warbringer|n|cFFFFD200Zone: |rDread Wastes, Kun-Lai Summit, Townlong Steppes, Valley of the Four Winds","0","230","0","0","0","43"
"537","138640","Bone-White Primal Raptor","""They are lethal at eight months, very lethal."" -Hemet Nesingwary Jr.","|cFFFFD200Quest: |rA Mountain of Giant Dinosaur Bones|n|cFFFFD200Zone: |rIsle of Giants","0","230","0","1","0","4"
"538","138641","Red Primal Raptor","Raptors have spread to nearly all of the lands of Azeroth. It is uncertain whether the trolls led them or followed them.","|cFFFFD200Drop:|r Cracked Primal Egg","0","230","0","0","0","4"
"539","138642","Black Primal Raptor","Speed, cunning, and ferocity are the things trolls and raptors admire about each other.","|cFFFFD200Drop:|r Cracked Primal Egg","0","230","0","0","0","4"
"540","138643","Green Primal Raptor","""Raptors are as loyal as they are vicious. If you ain't friend, you are food."" -Kijara","|cFFFFD200Drop:|r Cracked Primal Egg","0","230","0","0","0","4"
"541","139407","Malevolent Gladiator's Cloud Serpent","These cloud serpents have scales that... are the color of clouds, actually.","|cFFFFD200Legacy|r","0","248","192","5","0","4"
"542","139442","Thundering Cobalt Cloud Serpent","This is a descendant of the irascible Nalak. Lightning erupts from its scales and arcs over the saddle. Dare you sit?","|cFFFFD200Drop:|r Nalak|n|cFFFFD200Location:|r Isle of Thunder|n","0","248","128","0","0","4"
"543","139448","Clutch of Ji-Kun","Although Ji-Kun feasted on the failed creations of mogu flesh-shapers, her progeny is willing to eat more pedestrian carcasses.","|cFFFFD200Drop: |rJi-Kun|n|cFFFFD200Zone: |rThrone of Thunder","0","248","128","0","0","43"
"544","139595","Armored Bloodwing","This monstrous, flesh-eating bat is the undisputed ruler of the night skies.","|cFFFFD200In-Game Shop|r","0","248","128","9","0","4"
"545","140249","Golden Primal Direhorn","Sharp at both ends and crafty in the middle. Leave it to the trolls to think this was a good idea.","|cFFFFD200Vendor: |rHiren Loresong|n|cFFFFD200Zone: |rIsle of Thunder|n|cFFFFD200Faction: |rKirin Tor Offensive - Exalted|n|cFFFFD200Cost: |r3000|TINTERFACE\MONEYFRAME\UI-GOLDICON.BLP:0|t","0","230","4","2","0","43"
"546","140250","Crimson Primal Direhorn","Leave it to the blood elves to pick the red one.","|cFFFFD200Vendor: |rVasarin Redmorn|n|cFFFFD200Zone: |rIsle of Thunder|n|cFFFFD200Faction: |rSunreaver Onslaught - Exalted|n|cFFFFD200Cost: |r3000|TINTERFACE\MONEYFRAME\UI-GOLDICON.BLP:0|t","0","230","4","2","0","43"
"547","142073","Hearthsteed","Each step echoes with the rage of your three opponents.","|cFFFFD200Promotion:|r Hearthstone|n","0","248","0","7","0","4"
"548","142266","Armored Red Dragonhawk","This rare breed of dragonhawk is a mark of honor in the Horde, gifted by the blood elves. It reflects your tireless effort to amass a small army of mounts.","|cFFFFD200Achievement: |rMount Parade|n|cFFFFD200Category: |rGeneral","0","248","132","5","0","4"
"549","142478","Armored Blue Dragonhawk","After you amassed a massive menagerie of 200 mounts, the animal authorities of the Alliance sent you a means to keep them in line (and out of their hair).","|cFFFFD200Achievement: |rMount Parade|n|cFFFFD200Category: |rGeneral","0","248","132","5","0","4"
"550","142641","Brawler's Burly Mushan Beast","For years pandaren believed these creatures to be untamable. Just ask the first pandaren to do so, Henshi ""Limp Along"" Homebrew.","|cFFFFD200Vendor: |rPaul North|n|cFFFFD200Zone: |rBrawl'gar Arena|n|cFFFFD200Cost: |r1500|TINTERFACE\MONEYFRAME\UI-GOLDICON.BLP:0|t","0","230","0","2","0","4"
"551","142878","Enchanted Fey Dragon","This majestic creature is Brightwing's older brother. He affirms that she was, in fact, adopted.","|cFFFFD200In-Game Shop|r","0","248","128","9","0","4"
"552","142910","Ironbound Wraithcharger","Its ethereal spirit is barely contained by its iron shell. The penultimate creation of Salanar the Horseman, these powerful steeds were once thought to have all been destroyed.","|cFFFFD200World Event:|r Timewalking|n|cFFFFD200Vendor:|r Auzin|n|cFFFFD200Location:|r Dalaran","0","248","0","6","0","4"
"554","146615","Vicious Warsaber","The blades adorning this mount's armor are designed to both inspire fear and pre-slice meals for the warsaber.","|cFFFFD200Vendor: |rNecrolord Sipe|n|cFFFFD200Zone: |rStormwind City|n|cFFFFD200Cost: |r1|TINTERFACE\ICONS\ACHIEVEMENT_BG_KILL_ON_MOUNT.BLP:0|t","0","230","4","2","0","4"
"555","146622","Vicious Skeletal Warhorse","Only rewarded to those who have bested their foes in battle.","|cFFFFD200Vendor: |rDeathguard Netharian|n|cFFFFD200Zone: |rOrgrimmar|n|cFFFFD200Cost: |r1|TINTERFACE\ICONS\ACHIEVEMENT_BG_KILL_ON_MOUNT.BLP:0|t","0","230","4","2","0","4"
"557","148392","Spawn of Galakras","This formidable creature's lineage may be traced to Galakras, and yet further to Galakrond, one of the most infamous of all proto-dragons.","|cFFFFD200Achievement: |rGlory of the Orgrimmar Raider|n|cFFFFD200Category: |rDungeons & Raids","0","248","128","5","0","44"
"558","148396","Kor'kron War Wolf","The Kor'kron use only the mightiest wolves for their mounts, bedecking them in armor that would break the backs of lesser creatures.","|cFFFFD200Achievement: |rAhead of the Curve: Garrosh Hellscream (10/25 player)|n|cFFFFD200Category: |rFeats of Strength","0","230","0","5","0","4"
"559","148417","Kor'kron Juggernaut","The Kor'kron Juggernaut is a weapon of unbridled destruction, born from the mind of Garrosh Hellscream and made real by his engineers.","|cFFFFD200Drop: |rGarrosh Hellscream|n|cFFFFD200Location:|r Siege of Orgrimmar","0","230","0","0","0","4"
"560","148428","Ashhide Mushan Beast","Some people say that riding an ashhide mushan will result in favorable health and increased prosperity. These people are called ""mount vendors.""","|cFFFFD200Vendor: |rSpeaker Gulan|n|cFFFFD200Zone: |rTimeless Isle|n|cFFFFD200Cost: |r500|TINTERFACE\ICONS\TimelessCoin-Bloody.blp:0|t","0","230","0","2","0","4"
"561","148476","Thundering Onyx Cloud Serpent","This ebony cloud serpent is a lightning-wreathed vision of such rarity as to have driven many mortals to madness.","|cFFFFD200Drop:|r Huolon|n|cFFFFD200Location:|r Timeless Isle","0","248","128","0","0","4"
"562","148618","Tyrannical Gladiator's Cloud Serpent","These cloud serpents always look elegant and slim in classic black.","|cFFFFD200Legacy|r","0","248","192","5","0","4"
"563","148619","Grievous Gladiator's Cloud Serpent","These brilliantly colored cloud serpents have scales that are a mixture of ruby, gold, and nearly violet.","|cFFFFD200Legacy|r","0","248","192","2","0","4"
"564","148620","Prideful Gladiator's Cloud Serpent","These brilliantly colored cloud serpents have scales that range from gold to pink. Or we could call it coral.","|cFFFFD200Legacy|r","0","248","192","5","0","4"
"568","149801","Emerald Hippogryph","These majestic animals come in various colorings, but the emerald variety can only be tamed by the magic of friendship.","|cFFFFD200Recruit-a-Friend|r","0","248","128","7","0","4"
"571","153489","Iron Skyreaver","Iron Horde beastmasters bred this rylak for war and then girded it for battle in black steel and smoldering flame.","|cFFFFD200In-Game Shop|r","0","248","128","9","0","4"
"593","163024","Warforged Nightmare","A nightmarish steed of hardened steel and vengeful spirits, this companion will follow you to the depths of the Firelands and back without complaint.","|cFFFFD200In-Game Shop|r","0","248","0","9","0","4"
"594","163025","Grinning Reaver","The difference between a smile and a grin is the difference between a kiss and tasting.","|cFFFFD200In-Game Shop|r","0","248","0","9","0","44"
"600","155741","Dread Raven","Filled with the hatred of an ancient god, the dread raven are the Arakkoa's most trusted guardians.","|cFFFFD200Promotion:|r Warlords of Draenor Collector's Edition|n","0","248","128","7","0","4"
"603","169952","Creeping Carpet","Can't fly, but can creep very quickly.","|cFFFFD200Profession:|r Tailoring","0","230","1024","3","26503","4"
"606","170347","Core Hound","Molten to the core!","|cFFFFD200Achievement:|r Boldly, You Sought the Power of Ragnaros|n|cFFFFD200Category:|r Feats of Strength","0","230","0","5","0","4"
"607","171436","Gorestrider Gronnling","Once ""befriended"", a gronnling will happily carry its rider to their death.","|cFFFFD200Achievement:|r Glory of the Draenor Raider","0","230","0","5","0","45"
"608","171616","Witherhide Cliffstomper","Tiny notches cover the hooves of this variation of clefthoof, allowing it to safely scale mountainous regions in search of food.","|cFFFFD200Vendor: |rTrader Araanda|n|cFFFFD200Zone: |rLunarfall|n|cFFFFD200Cost: |r20000|TINTERFACE\MONEYFRAME\UI-GOLDICON.BLP:0|t|n|n|cFFFFD200Vendor: |rTrader Darakk|n|cFFFFD200Zone: |rFrostwall|n|cFFFFD200Cost: |r20000|TINTERFACE\MONEYFRAME\UI-GOLDICON.BLP:0|t","0","230","0","2","0","44"
"609","171617","Trained Icehoof","It wasn't until you owned this mount that you understood how much the world of Draenor would test you. Clefthoof hair gets in everything!","|cFFFFD200Source:|r Garrison Stables|n","0","230","0","2","0","44"
"611","171619","Tundra Icehoof","A translucent layer of down hair covers this breed's leathery hide, acting as the perfect insulation for cold environments.","|cFFFFD200Drop:|r Vengeance, Deathtalon, Terrorfist, Doomroller|n|cFFFFD200Zone:|r Tanaan Jungle|n","0","230","0","0","0","44"
"612","171620","Bloodhoof Bull","Members of the Warsong clan have long hunted these clefthoof to use their crimson-hued skin for battle standards.","|cFFFFD200Drop:|r Nakk the Thunderer|n|cFFFFD200Location:|r Nagrand","0","230","0","0","0","44"
"613","171621","Ironhoof Destroyer","Blackhand is said to have personally designed the fiery armaments used on the Iron Horde's clefthoof battle mounts.","|cFFFFD200Drop:|r Blackhand|n|cFFFFD200Location:|r Blackrock Foundry (Mythic)","0","230","0","0","0","44"
"614","171622","Mottled Meadowstomper","The elekk's long trunk allows it to sniff out sources of food, avoid danger, and steal snacks from your bags when you're not looking.","|cFFFFD200Drop:|r Luk'hok|n|cFFFFD200Zone:|r Nagrand","0","230","0","0","0","44"
"615","171623","Trained Meadowstomper","The draenei perfected elekk husbandry long ago, adorning the creatures with Light-infused crystals to make them more docile.","|cFFFFD200Quest:|r Garrison Stables","0","230","0","1","0","44"
"616","171624","Shadowhide Pearltusk","Some legends say the draenei first befriended the elekk after one of the beasts saved an injured scout from a pack of vicious podlings.","|cFFFFD200Drop:|r Invader's Forgotten Treasure","0","230","0","0","0","44"
